{
  "schemaVersion": "course1-technical-requirement-graph-v1",
  "courseId": "course-1-controlled-ai-workflow-foundations",
  "contractPath": "COURSE_1_TECHNICAL_ACCEPTANCE_CONTRACT.md",
  "requirements": [
    {"id":"C1-TA-DATA-001","family":"DATA","tests":["C1-TST-DATA-001","C1-TST-WIN-E2E-001"]},
    {"id":"C1-TA-DATA-002","family":"DATA","tests":["C1-TST-DATA-001","C1-TST-WIN-E2E-001"]},
    {"id":"C1-TA-DATA-003","family":"DATA","tests":["C1-TST-DATA-001","C1-TST-WIN-E2E-001"]},
    {"id":"C1-TA-DATA-004","family":"DATA","tests":["C1-TST-DATA-001"]},
    {"id":"C1-TA-FS-001","family":"FS","tests":["C1-TST-FS-001"]},
    {"id":"C1-TA-FS-002","family":"FS","tests":["C1-TST-FS-002"]},
    {"id":"C1-TA-FS-003","family":"FS","tests":["C1-TST-FS-003"]},
    {"id":"C1-TA-FS-004","family":"FS","tests":["C1-TST-FS-004"]},
    {"id":"C1-TA-FS-005","family":"FS","tests":["C1-TST-FS-005"]},
    {"id":"C1-TA-FS-006","family":"FS","tests":["C1-TST-FS-006"]},
    {"id":"C1-TA-FS-007","family":"FS","tests":["C1-TST-FS-007"]},
    {"id":"C1-TA-FS-008","family":"FS","tests":["C1-TST-FS-008"]},
    {"id":"C1-TA-FS-009","family":"FS","tests":["C1-TST-FS-009"]},
    {"id":"C1-TA-FS-010","family":"FS","tests":["C1-TST-FS-010"]},
    {"id":"C1-TA-FS-011","family":"FS","tests":["C1-TST-FS-011"]},
    {"id":"C1-TA-IO-001","family":"IO","tests":["C1-TST-IO-001"]},
    {"id":"C1-TA-IO-002","family":"IO","tests":["C1-TST-IO-001"]},
    {"id":"C1-TA-IO-003","family":"IO","tests":["C1-TST-IO-001"]},
    {"id":"C1-TA-IO-004","family":"IO","tests":["C1-TST-IO-001"]},
    {"id":"C1-TA-IO-005","family":"IO","tests":["C1-TST-IO-001"]},
    {"id":"C1-TA-IO-006","family":"IO","tests":["C1-TST-IO-001"]},
    {"id":"C1-TA-IO-007","family":"IO","tests":["C1-TST-IO-001"]},
    {"id":"C1-TA-IO-008","family":"IO","tests":["C1-TST-IO-001"]},
    {"id":"C1-TA-IO-009","family":"IO","tests":["C1-TST-IO-002"]},
    {"id":"C1-TA-IO-010","family":"IO","tests":["C1-TST-IO-002"]},
    {"id":"C1-TA-IO-011","family":"IO","tests":["C1-TST-IO-002"]},
    {"id":"C1-TA-IO-012","family":"IO","tests":["C1-TST-IO-002"]},
    {"id":"C1-TA-IO-013","family":"IO","tests":["C1-TST-IO-002"]},
    {"id":"C1-TA-CAP-001","family":"CAP","tests":["C1-TST-CAP-001"]},
    {"id":"C1-TA-CAP-002","family":"CAP","tests":["C1-TST-CAP-002"]},
    {"id":"C1-TA-CAP-003","family":"CAP","tests":["C1-TST-CAP-003"]},
    {"id":"C1-TA-CAP-004","family":"CAP","tests":["C1-TST-CAP-001"]},
    {"id":"C1-TA-CAP-005","family":"CAP","tests":["C1-TST-CAP-005"]},
    {"id":"C1-TA-CAP-006","family":"CAP","tests":["C1-TST-CAP-001"]},
    {"id":"C1-TA-CAP-007","family":"CAP","tests":["C1-TST-PWA-NET-001"]},
    {"id":"C1-TA-PWA-001","family":"PWA","tests":["C1-TST-PWA-STORAGE-001"]},
    {"id":"C1-TA-PWA-002","family":"PWA","tests":["C1-TST-PWA-STORAGE-001"]},
    {"id":"C1-TA-PWA-003","family":"PWA","tests":["C1-TST-PWA-STORAGE-001"]},
    {"id":"C1-TA-PWA-004","family":"PWA","tests":["C1-TST-PWA-NET-001","C1-TST-PWA-STORAGE-001"]},
    {"id":"C1-TA-PWA-005","family":"PWA","tests":["C1-TST-PWA-STORAGE-001"]},
    {"id":"C1-TA-PWA-006","family":"PWA","tests":["C1-TST-PWA-STORAGE-001"]},
    {"id":"C1-TA-PWA-007","family":"PWA","tests":["C1-TST-PWA-STORAGE-001"]},
    {"id":"C1-TA-PWA-008","family":"PWA","tests":["C1-TST-PWA-BACKUP-001"]},
    {"id":"C1-TA-PWA-009","family":"PWA","tests":["C1-TST-PWA-BACKUP-001"]},
    {"id":"C1-TA-PWA-010","family":"PWA","tests":["C1-TST-PWA-BACKUP-001"]},
    {"id":"C1-TA-PWA-011","family":"PWA","tests":["C1-TST-PWA-BACKUP-001"]},
    {"id":"C1-TA-PWA-012","family":"PWA","tests":["C1-TST-PWA-BACKUP-001"]},
    {"id":"C1-TA-PWA-013","family":"PWA","tests":["C1-TST-PWA-BACKUP-001"]},
    {"id":"C1-TA-PWA-014","family":"PWA","tests":["C1-TST-PWA-BACKUP-001"]},
    {"id":"C1-TA-WEB-001","family":"WEB","tests":["C1-TST-WEB-001","C1-TST-WEB-002"]},
    {"id":"C1-TA-WEB-002","family":"WEB","tests":["C1-TST-WEB-001","C1-TST-WEB-002"]},
    {"id":"C1-TA-WEB-003","family":"WEB","tests":["C1-TST-WEB-001","C1-TST-WEB-002","C1-TST-WEB-003"]},
    {"id":"C1-TA-WEB-004","family":"WEB","tests":["C1-TST-WEB-001","C1-TST-WEB-002"]},
    {"id":"C1-TA-WEB-005","family":"WEB","tests":["C1-TST-WEB-001","C1-TST-WEB-002"]},
    {"id":"C1-TA-WEB-006","family":"WEB","tests":["C1-TST-WEB-001","C1-TST-WEB-002"]},
    {"id":"C1-TA-WEB-007","family":"WEB","tests":["C1-TST-WEB-001","C1-TST-WEB-002"]},
    {"id":"C1-TA-WEB-008","family":"WEB","tests":["C1-TST-WEB-001","C1-TST-WEB-002"]},
    {"id":"C1-TA-SW-001","family":"SW","tests":["C1-TST-SW-001"]},
    {"id":"C1-TA-SW-002","family":"SW","tests":["C1-TST-SW-001"]},
    {"id":"C1-TA-SW-003","family":"SW","tests":["C1-TST-SW-001"]},
    {"id":"C1-TA-SW-004","family":"SW","tests":["C1-TST-SW-001"]},
    {"id":"C1-TA-SW-005","family":"SW","tests":["C1-TST-SW-001"]},
    {"id":"C1-TA-SW-006","family":"SW","tests":["C1-TST-SW-001"]},
    {"id":"C1-TA-SW-007","family":"SW","tests":["C1-TST-SW-002"]},
    {"id":"C1-TA-SW-008","family":"SW","tests":["C1-TST-SW-002"]},
    {"id":"C1-TA-SW-009","family":"SW","tests":["C1-TST-SW-002"]},
    {"id":"C1-TA-SW-010","family":"SW","tests":["C1-TST-SW-002"]},
    {"id":"C1-TA-SC-001","family":"SC","tests":["C1-TST-SC-001"]},
    {"id":"C1-TA-SC-002","family":"SC","tests":["C1-TST-SC-001"]},
    {"id":"C1-TA-SC-003","family":"SC","tests":["C1-TST-SC-001"]},
    {"id":"C1-TA-SC-004","family":"SC","tests":["C1-TST-SC-001"]},
    {"id":"C1-TA-SC-005","family":"SC","tests":["C1-TST-SC-001"]},
    {"id":"C1-TA-SC-006","family":"SC","tests":["C1-TST-SC-001"]},
    {"id":"C1-TA-SC-007","family":"SC","tests":["C1-TST-SC-001"]},
    {"id":"C1-TA-SC-008","family":"SC","tests":["C1-TST-SC-001"]},
    {"id":"C1-TA-SC-009","family":"SC","tests":["C1-TST-SC-001"]},
    {"id":"C1-TA-SC-010","family":"SC","tests":["C1-TST-PROV-001"]},
    {"id":"C1-TA-SC-011","family":"SC","tests":["C1-TST-PROV-001"]},
    {"id":"C1-TA-SC-012","family":"SC","tests":["C1-TST-PROV-001"]},
    {"id":"C1-TA-TEST-001","family":"TEST","tests":["C1-TST-ORACLE-001"]},
    {"id":"C1-TA-TEST-002","family":"TEST","tests":["C1-TST-ORACLE-001"]},
    {"id":"C1-TA-TEST-003","family":"TEST","tests":["C1-TST-QUALITY-001"]},
    {"id":"C1-TA-TEST-004","family":"TEST","tests":["C1-TST-QUALITY-001"]},
    {"id":"C1-TA-TEST-005","family":"TEST","tests":["C1-TST-QUALITY-001"]},
    {"id":"C1-TA-TEST-006","family":"TEST","tests":["C1-TST-QUALITY-001"]},
    {"id":"C1-TA-TEST-007","family":"TEST","tests":["C1-TST-QUALITY-001"]},
    {"id":"C1-TA-TEST-008","family":"TEST","tests":["C1-TST-QUALITY-001"]},
    {"id":"C1-TA-TEST-009","family":"TEST","tests":["C1-TST-QUALITY-001"]},
    {"id":"C1-TA-WIN-001","family":"WIN","tests":["C1-TST-WIN-E2E-001"]},
    {"id":"C1-TA-WIN-002","family":"WIN","tests":["C1-TST-WIN-E2E-001"]},
    {"id":"C1-TA-WIN-003","family":"WIN","tests":["C1-TST-WIN-E2E-001"]},
    {"id":"C1-TA-WIN-004","family":"WIN","tests":["C1-TST-WIN-E2E-001"]},
    {"id":"C1-TA-WIN-005","family":"WIN","tests":["C1-TST-WIN-E2E-001"]},
    {"id":"C1-TA-WIN-006","family":"WIN","tests":["C1-TST-IO-002","C1-TST-WIN-E2E-001"]},
    {"id":"C1-TA-WIN-007","family":"WIN","tests":["C1-TST-IO-002","C1-TST-WIN-E2E-001"]},
    {"id":"C1-TA-WIN-008","family":"WIN","tests":["C1-TST-WIN-E2E-001"]},
    {"id":"C1-TA-WIN-009","family":"WIN","tests":["C1-TST-WIN-E2E-001"]},
    {"id":"C1-TA-WIN-010","family":"WIN","tests":["C1-TST-WIN-E2E-001"]},
    {"id":"C1-TA-WIN-011","family":"WIN","tests":["C1-TST-WIN-E2E-001"]},
    {"id":"C1-TA-WIN-012","family":"WIN","tests":["C1-TST-WIN-E2E-001"]},
    {"id":"C1-TA-BR-001","family":"BR","tests":["C1-TST-BROWSER-MATRIX-001"]},
    {"id":"C1-TA-BR-002","family":"BR","tests":["C1-TST-BROWSER-MATRIX-001"]},
    {"id":"C1-TA-BR-003","family":"BR","tests":["C1-TST-BROWSER-MATRIX-001"]},
    {"id":"C1-TA-BR-004","family":"BR","tests":["C1-TST-BROWSER-MATRIX-001"]},
    {"id":"C1-TA-BR-005","family":"BR","tests":["C1-TST-BROWSER-MATRIX-001"]},
    {"id":"C1-TA-BR-006","family":"BR","tests":["C1-TST-BROWSER-MATRIX-001"]},
    {"id":"C1-TA-BR-007","family":"BR","tests":["C1-TST-BROWSER-MATRIX-001"]},
    {"id":"C1-TA-BR-008","family":"BR","tests":["C1-TST-BROWSER-MATRIX-001"]},
    {"id":"C1-TA-REC-001","family":"REC","tests":["C1-TST-RECOVERY-001"]},
    {"id":"C1-TA-REC-002","family":"REC","tests":["C1-TST-RECOVERY-001"]},
    {"id":"C1-TA-REC-003","family":"REC","tests":["C1-TST-RECOVERY-001"]},
    {"id":"C1-TA-REC-004","family":"REC","tests":["C1-TST-RECOVERY-001"]},
    {"id":"C1-TA-REC-005","family":"REC","tests":["C1-TST-RECOVERY-001"]},
    {"id":"C1-TA-REC-006","family":"REC","tests":["C1-TST-RECOVERY-001"]},
    {"id":"C1-TA-REC-007","family":"REC","tests":["C1-TST-RECOVERY-001"]},
    {"id":"C1-TA-REC-008","family":"REC","tests":["C1-TST-RECOVERY-001"]},
    {"id":"C1-TA-REC-009","family":"REC","tests":["C1-TST-SW-002"]},
    {"id":"C1-TA-REC-010","family":"REC","tests":["C1-TST-PROV-001"]}
  ],
  "tests": [
    {"id":"C1-TST-DATA-001","requirements":["C1-TA-DATA-001","C1-TA-DATA-002","C1-TA-DATA-003","C1-TA-DATA-004"]},
    {"id":"C1-TST-FS-001","requirements":["C1-TA-FS-001"]},
    {"id":"C1-TST-FS-002","requirements":["C1-TA-FS-002"]},
    {"id":"C1-TST-FS-003","requirements":["C1-TA-FS-003"]},
    {"id":"C1-TST-FS-004","requirements":["C1-TA-FS-004"]},
    {"id":"C1-TST-FS-005","requirements":["C1-TA-FS-005"]},
    {"id":"C1-TST-FS-006","requirements":["C1-TA-FS-006"]},
    {"id":"C1-TST-FS-007","requirements":["C1-TA-FS-007"]},
    {"id":"C1-TST-FS-008","requirements":["C1-TA-FS-008"]},
    {"id":"C1-TST-FS-009","requirements":["C1-TA-FS-009"]},
    {"id":"C1-TST-FS-010","requirements":["C1-TA-FS-010"]},
    {"id":"C1-TST-FS-011","requirements":["C1-TA-FS-011"]},
    {"id":"C1-TST-IO-001","requirements":["C1-TA-IO-001","C1-TA-IO-002","C1-TA-IO-003","C1-TA-IO-004","C1-TA-IO-005","C1-TA-IO-006","C1-TA-IO-007","C1-TA-IO-008"]},